{
  "name": "fengshui-master-tool-catalog",
  "version": "1.0.0",
  "purpose": "Machine-readable script metadata for agent tool registration, CLI wrappers, function calling adapters, and integration smoke tests.",
  "tools": [
    {
      "name": "method_selector",
      "path": "fengshui-master/scripts/method_selector.py",
      "category": "routing",
      "description": "Select appropriate feng shui methods, references, tools, required inputs, and guardrails for a request.",
      "command_template": "python fengshui-master/scripts/method_selector.py \"<question>\" --pretty",
      "inputs": [
        {"name": "question", "type": "string", "required": true, "description": "User question or task description."},
        {"name": "limit", "type": "integer", "required": false, "description": "Maximum candidate methods to return."},
        {"name": "pretty", "type": "boolean", "required": false, "description": "Print indented JSON."}
      ],
      "output_format": "json",
      "risk_level": "medium",
      "required_guardrails": ["name the selected method", "do not mix schools silently"]
    },
    {
      "name": "domain_router",
      "path": "fengshui-master/scripts/domain_router.py",
      "category": "routing",
      "description": "Route a user question to candidate domains, references, guardrails, risk level, ambiguity status, clarification prompts, and symbolic-analysis eligibility.",
      "command_template": "python fengshui-master/scripts/domain_router.py \"<question>\" --pretty",
      "inputs": [
        {"name": "question", "type": "string", "required": true, "description": "User question or short task description."},
        {"name": "pretty", "type": "boolean", "required": false, "description": "Print indented JSON."}
      ],
      "output_format": "json",
      "risk_level": "low",
      "required_guardrails": ["route before answering substantial requests"]
    },
    {
      "name": "create_brief",
      "path": "fengshui-master/scripts/create_brief.py",
      "category": "briefing",
      "description": "Create a proactive-first cross-domain consultation brief with a machine-readable delivery sequence, domain priorities, question budget, references, guardrails, input state, risk metadata, lenses, and report sections.",
      "command_template": "python fengshui-master/scripts/create_brief.py \"<question>\" --pretty",
      "inputs": [
        {"name": "question", "type": "string", "required": true, "description": "User question or consultation goal."},
        {"name": "floorplan", "type": "path", "required": false, "description": "Optional structured floor-plan JSON path."},
        {"name": "pretty", "type": "boolean", "required": false, "description": "Print indented JSON."}
      ],
      "output_format": "json",
      "risk_level": "medium",
      "required_guardrails": ["preserve brief guardrails in final answer", "lead with the provisional posture before questions", "ask no more than three follow-up questions"]
    },
    {
      "name": "personal_context",
      "path": "fengshui-master/scripts/personal_context.py",
      "category": "personal_context",
      "description": "Combine bounded birth-year, ming gua, current-year, san yuan, annual-direction, solar-term, and moon-phase scaffolds with a proactive-first personal-reading contract.",
      "command_template": "python fengshui-master/scripts/personal_context.py --birth-date <YYYY-MM-DD> --as-of <YYYY-MM-DD> --pretty",
      "inputs": [
        {"name": "birth_date", "type": "date", "required": true, "description": "Gregorian birth date in YYYY-MM-DD format."},
        {"name": "birth_time", "type": "string", "required": false, "description": "Civil birth time in 24-hour HH:MM format; recorded but not converted into an hour pillar."},
        {"name": "sex", "type": "string", "required": false, "description": "Formula input for the common ming gua helper: male or female."},
        {"name": "birth_location", "type": "string", "required": false, "description": "Birth locality for provenance and future timezone-sensitive integrations."},
        {"name": "timezone", "type": "string", "required": false, "description": "IANA-style timezone label when known."},
        {"name": "as_of", "type": "date", "required": false, "description": "Gregorian analysis date; defaults to the current local date."},
        {"name": "year_boundary", "type": "string", "required": false, "description": "Year-level convention: gregorian or documented li_chun_approx."},
        {"name": "pretty", "type": "boolean", "required": false, "description": "Print indented JSON."}
      ],
      "output_format": "json",
      "risk_level": "high",
      "required_guardrails": ["not a complete bazi", "do not make deterministic fate claims", "sparse inputs lower confidence rather than suppress the reading"]
    },
    {
      "name": "generate_report",
      "path": "fengshui-master/scripts/generate_report.py",
      "category": "reporting",
      "description": "Generate a proactive-first Markdown consultation scaffold that puts the current posture and actions before method details or follow-up questions.",
      "command_template": "python fengshui-master/scripts/generate_report.py \"<question>\"",
      "inputs": [
        {"name": "question", "type": "string", "required": true, "description": "User question or consultation goal."},
        {"name": "floorplan", "type": "path", "required": false, "description": "Optional structured floor-plan JSON path."},
        {"name": "output", "type": "path", "required": false, "description": "Optional output Markdown path."}
      ],
      "output_format": "markdown",
      "risk_level": "medium",
      "required_guardrails": ["treat report as a scaffold not final authority", "stop symbolic analysis for urgent safety routes", "ask no more than three follow-up questions"]
    },
    {
      "name": "analyze_floorplan",
      "path": "fengshui-master/scripts/analyze_floorplan.py",
      "category": "floorplan",
      "description": "Validate structured floor-plan semantics and produce source-linked form findings, unit-aware issues, constrained recommendations, and explicit not_assessed results.",
      "command_template": "python fengshui-master/scripts/analyze_floorplan.py <floorplan.json> --pretty",
      "inputs": [
        {"name": "path", "type": "path", "required": true, "description": "Path to structured floor-plan JSON."},
        {"name": "pretty", "type": "boolean", "required": false, "description": "Print indented JSON."}
      ],
      "output_format": "json",
      "risk_level": "medium",
      "required_guardrails": ["verify structured input with photos or measurements when precision matters"]
    },
    {
      "name": "bagua_map",
      "path": "fengshui-master/scripts/bagua_map.py",
      "category": "calculation",
      "description": "Return later-heaven bagua symbolism under separate compass, door-aligned, or symbolic input contracts, with bearing-boundary uncertainty when applicable.",
      "command_template": "python fengshui-master/scripts/bagua_map.py --direction <direction> --pretty",
      "inputs": [
        {"name": "direction", "type": "string", "required": false, "description": "Direction such as north, southeast, or NW."},
        {"name": "degrees", "type": "number", "required": false, "description": "Compass bearing in degrees."},
        {"name": "trigram", "type": "string", "required": false, "description": "Trigram key such as qian, kan, li, or xun."},
        {"name": "life_area", "type": "string", "required": false, "description": "Life area such as wealth, career, relationship, or helpful_people."},
        {"name": "method", "type": "string", "required": false, "description": "Bagua method label: compass, door_aligned, or symbolic."},
        {"name": "uncertainty_degrees", "type": "number", "required": false, "description": "Optional non-negative bearing uncertainty used with degrees."},
        {"name": "pretty", "type": "boolean", "required": false, "description": "Print indented JSON."}
      ],
      "output_format": "json",
      "risk_level": "medium",
      "required_guardrails": ["do not guarantee auspiciousness", "do not mix bagua methods silently"]
    },
    {
      "name": "luopan",
      "path": "fengshui-master/scripts/luopan.py",
      "category": "calculation",
      "description": "Map a finite compass bearing to a 24-mountain sector and expose boundary distance, measurement uncertainty, and north basis.",
      "command_template": "python fengshui-master/scripts/luopan.py <degrees> --pretty",
      "inputs": [
        {"name": "bearing", "type": "number", "required": true, "description": "Compass bearing in degrees."},
        {"name": "uncertainty_degrees", "type": "number", "required": false, "description": "Optional non-negative estimated bearing uncertainty."},
        {"name": "north_basis", "type": "string", "required": false, "description": "magnetic, true, grid, or unspecified."},
        {"name": "pretty", "type": "boolean", "required": false, "description": "Print indented JSON."}
      ],
      "output_format": "json",
      "risk_level": "low",
      "required_guardrails": ["verify compass measurement and facing convention"]
    },
    {
      "name": "minggua",
      "path": "fengshui-master/scripts/minggua.py",
      "category": "calculation",
      "description": "Calculate a common Eight Mansions personal ming gua number and direction set.",
      "command_template": "python fengshui-master/scripts/minggua.py <year> --sex <male|female> --pretty",
      "inputs": [
        {"name": "year", "type": "integer", "required": true, "description": "Gregorian birth year, 1900-2099."},
        {"name": "sex", "type": "string", "required": true, "description": "Formula input: male or female."},
        {"name": "pretty", "type": "boolean", "required": false, "description": "Print indented JSON."}
      ],
      "output_format": "json",